{
  "schema_version": "rulebook_v1",
  "rulebook_id": "pricing_exception",
  "version": "2026-07-01",
  "input_schema": {
    "required": [
      "discount_percent",
      "margin_percent"
    ],
    "properties": {
      "discount_percent": {
        "type": "number"
      },
      "margin_percent": {
        "type": "number"
      }
    }
  },
  "rules": [
    {
      "rule_id": "block_below_margin_floor",
      "priority": 100,
      "condition": {
        "field": "margin_percent",
        "operator": "lt",
        "value": 15
      },
      "outcome": {
        "decision": "no",
        "verdict": "BLOCK",
        "action": "reject_discount",
        "reason_code": "MARGIN_FLOOR_BREACH"
      }
    },
    {
      "rule_id": "approve_standard_exception",
      "priority": 50,
      "condition": {
        "all": [
          {
            "field": "discount_percent",
            "operator": "lte",
            "value": 12
          },
          {
            "field": "margin_percent",
            "operator": "gte",
            "value": 15
          }
        ]
      },
      "outcome": {
        "decision": "yes",
        "verdict": "APPROVE",
        "action": "approve_discount",
        "reason_code": "STANDARD_EXCEPTION_ALLOWED"
      }
    }
  ],
  "default_outcome": {
    "decision": "review",
    "verdict": "REVIEW",
    "action": "route_to_owner",
    "reason_code": "NO_RULE_MATCHED"
  }
}
